{
  "schema_version": 1,
  "id": "ghost",
  "display_name": "Призрак",
  "description": "Это большой звездолет повстанцев. Воскрешение: при взрыве превращается в Фантом.",
  "group": 2,
  "draftable": true,
  "draft_cost": 6,
  "max_hp": 6,
  "max_shield": 1,
  "initial_charges": 3,
  "max_charges": 5,
  "strength_die": { "count": 1, "sides": 6 },
  "arc_modifiers": [2, 1, 0, 2, 0, 1],
  "abilities": [
    { "id": "transform_to_phantom", "enabled": true, "transform_to": "phantom" }
  ]
}
