{
  "schema_version": 1,
  "id": "vulture_droid",
  "display_name": "Дроид-стервятник",
  "description": "Дроид сепаратистов из первых трех эпизодов. С шансом ½ может перебросить кубик, если выпало 1 при атаке.",
  "group": 1,
  "draftable": true,
  "draft_cost": 5,
  "max_hp": 4,
  "max_shield": 0,
  "initial_charges": 3,
  "max_charges": 5,
  "strength_die": { "count": 1, "sides": 6 },
  "arc_modifiers": [1, 1, 1, 0, 1, 1],
  "abilities": [
    { "id": "reroll_one", "enabled": true }
  ]
}
