{
  "schema_version": 1,
  "id": "tie_advanced_x1",
  "display_name": "TIE Advanced X1",
  "description": "Усовершенствованный истребитель СИД X1. Звездный истребитель Вейдера. Вы могли видеть это сид в битве у Звезды Смерти в 4 эпизоде.",
  "group": 2,
  "draftable": true,
  "draft_cost": 7,
  "max_hp": 6,
  "max_shield": 1,
  "initial_charges": 3,
  "max_charges": 5,
  "strength_die": { "count": 1, "sides": 6 },
  "arc_modifiers": [3, 1, 1, 0, 1, 1],
  "abilities": []
}
