{
  "schema_version": 1,
  "id": "millennium_falcon",
  "display_name": "Сокол тысячелетия",
  "description": "Сокол тысячелетия с Хан Соло на борту смог пройти Дугу Кесселя по более короткой траектории, пролетев ближе к черным дырам, что потребовало высочайшей скорости и мощности гипердвигателя.",
  "group": 2,
  "draftable": true,
  "draft_cost": 8,
  "max_hp": 8,
  "max_shield": 1,
  "initial_charges": 3,
  "max_charges": 5,
  "strength_die": { "count": 1, "sides": 6 },
  "arc_modifiers": [2, 1, 2, 0, 2, 1],
  "abilities": []
}
