{
  "schema_version": 1,
  "id": "star_destroyer",
  "display_name": "Имперский звёздный разрушитель",
  "description": "Однажды Сокол тысячелетия с Хан Соло на борту пролетел в очень маленькое пространство между двумя разрушителями, которые чуть не столкнулись, пытаясь его схватить.",
  "group": 2,
  "draftable": true,
  "draft_cost": 9,
  "max_hp": 8,
  "max_shield": 1,
  "initial_charges": 3,
  "max_charges": 5,
  "strength_die": { "count": 1, "sides": 6 },
  "arc_modifiers": [2, 2, 1, 1, 1, 2],
  "abilities": []
}
